[
  {
    "id": "coalition:kabinet-balkenende-i",
    "government": "org:regering",
    "name": "Kabinet-Balkenende I",
    "parties": [
      "CDA",
      "LPF",
      "VVD"
    ],
    "start": "2002-07-22",
    "end": "2003-05-27",
    "demissionairSince": "2002-10-16",
    "primeMinister": null,
    "agreement": null,
    "kind": "meerderheid",
    "notes": "93 van 150 zetels (62%) volgens src:pdc-kabinet-balkenende-i-2002-2003. Partijvolgorde volgens src:pdc-kabinet-balkenende-i-2002-2003 (CDA, LPF, VVD). Minister-president J.P. Balkenende (CDA) staat niet in people.json.",
    "source": {
      "source": "src:rijksoverheid-kabinet-balkenende-i",
      "retrieved": "2026-09-19",
      "confidence": "high"
    }
  },
  {
    "id": "coalition:kabinet-balkenende-ii",
    "government": "org:regering",
    "name": "Kabinet-Balkenende II",
    "parties": [
      "CDA",
      "VVD",
      "D66"
    ],
    "start": "2003-05-27",
    "end": "2006-07-07",
    "demissionairSince": "2006-06-30",
    "primeMinister": null,
    "agreement": null,
    "kind": "meerderheid",
    "notes": "78 van 150 zetels (52%) volgens src:pdc-kabinet-balkenende-ii-2003-2006. Op 30-06-2006 boden de D66-bewindspersonen hun ontslag aan; de overige leden stelden hun portefeuilles ter beschikking. Opgevolgd door het apart beëdigde kabinet-Balkenende III (07-07-2006). Hoofdlijnenakkoord 'Meedoen, meer werk en minder regels' van 16-05-2003 (src:pdc-kabinet-balkenende-ii-2003-2006) niet als document op rijksoverheid.nl gevonden. Minister-president J.P. Balkenende (CDA) staat niet in people.json.",
    "source": {
      "source": "src:rijksoverheid-kabinet-balkenende-ii",
      "retrieved": "2026-09-19",
      "confidence": "high"
    }
  },
  {
    "id": "coalition:kabinet-balkenende-iii",
    "government": "org:regering",
    "name": "Kabinet-Balkenende III",
    "parties": [
      "CDA",
      "VVD"
    ],
    "start": "2006-07-07",
    "end": "2007-02-22",
    "demissionairSince": "2006-11-22",
    "primeMinister": null,
    "agreement": null,
    "kind": "minderheid",
    "notes": "Missionair overgangskabinet van CDA en VVD, gevormd na het vertrek van D66 uit het kabinet-Balkenende II; apart beëdigd op 07-07-2006. Minderheidskabinet: 71 van 150 zetels (47,3%) volgens src:pdc-kabinet-balkenende-iii-2006-2007. Geen nieuw regeerakkoord (src:pdc-kabinet-balkenende-iii-2006-2007). Ontslagaanvraag 22-11-2006 volgens src:pdc-kabinet-balkenende-iii-2006-2007 (Rijksoverheid noemt geen datum). Minister-president J.P. Balkenende (CDA) staat niet in people.json.",
    "source": {
      "source": "src:rijksoverheid-kabinet-balkenende-iii",
      "retrieved": "2026-09-19",
      "confidence": "high"
    }
  },
  {
    "id": "coalition:kabinet-balkenende-iv",
    "government": "org:regering",
    "name": "Kabinet-Balkenende IV",
    "parties": [
      "CDA",
      "PvdA",
      "CU"
    ],
    "start": "2007-02-22",
    "end": "2010-02-23",
    "demissionairSince": "2010-02-20",
    "primeMinister": null,
    "agreement": "src:rijksoverheid-coalitieakkoord-2007",
    "kind": "meerderheid",
    "notes": "Partijvolgorde volgens het coalitieakkoord 'Samen werken, samen leven' (CDA, PvdA, ChristenUnie). Op 20-02-2010 bood minister-president Balkenende het ontslag van de PvdA-bewindspersonen aan (Rijksoverheid); zij traden af op 23-02-2010. 80 van 150 zetels (53,3%) volgens src:pdc-kabinet-balkenende-iv-2007-2010. Minister-president J.P. Balkenende (CDA) staat niet in people.json.",
    "source": {
      "source": "src:rijksoverheid-kabinet-balkenende-iv",
      "retrieved": "2026-09-19",
      "confidence": "high"
    }
  },
  {
    "id": "coalition:kabinet-balkenende-iv-romp",
    "government": "org:regering",
    "name": "Kabinet-Balkenende IV (rompkabinet CDA-ChristenUnie)",
    "parties": [
      "CDA",
      "CU"
    ],
    "start": "2010-02-23",
    "end": "2010-10-14",
    "demissionairSince": "2010-02-23",
    "primeMinister": null,
    "agreement": "src:rijksoverheid-coalitieakkoord-2007",
    "kind": "rompkabinet",
    "notes": "Rompkabinet nadat de PvdA-bewindspersonen op 23-02-2010 aftraden; demissionair vanaf de eerste dag (src:pdc-kabinet-balkenende-iv-2007-2010: 'Na 23 februari 2010 maakte de PvdA geen deel meer uit van het kabinet en was het kabinet demissionair'). 47 van 150 zetels (31,3%) volgens src:pdc-kabinet-balkenende-iv-2007-2010. Minister-president J.P. Balkenende (CDA) staat niet in people.json.",
    "source": {
      "source": "src:rijksoverheid-kabinet-balkenende-iv",
      "retrieved": "2026-09-19",
      "confidence": "high"
    }
  },
  {
    "id": "coalition:kabinet-beel-i",
    "government": "org:regering",
    "name": "Kabinet-Beel I",
    "parties": [
      "KVP",
      "PvdA"
    ],
    "start": "1946-07-03",
    "end": "1948-08-07",
    "demissionairSince": "1948-07-07",
    "primeMinister": null,
    "agreement": null,
    "kind": "meerderheid",
    "notes": "61 van 100 zetels volgens src:pdc-kabinet-beel-i-1946-1948; daarnaast drie partijloze bewindspersonen. Ontslagaanvraag 07-07-1948 volgens src:pdc-kabinet-beel-i-1946-1948. Minister-president L.J.M. Beel (KVP) staat niet in people.json.",
    "source": {
      "source": "src:rijksoverheid-kabinet-beel-i",
      "retrieved": "2026-09-19",
      "confidence": "high"
    }
  },
  {
    "id": "coalition:kabinet-beel-ii",
    "government": "org:regering",
    "name": "Kabinet-Beel II",
    "parties": [
      "KVP",
      "ARP",
      "CHU"
    ],
    "start": "1958-12-22",
    "end": "1959-05-19",
    "demissionairSince": "1959-03-12",
    "primeMinister": null,
    "agreement": null,
    "kind": null,
    "notes": "Overgangskabinet (interimkabinet) van KVP, ARP en CHU volgens src:pdc-kabinet-beel-ii-1958-1959, gevormd na het vertrek van de PvdA-ministers uit het kabinet-Drees III; 77 van 150 zetels (51,3%). Geen waarde in de kind-enum voor een overgangskabinet, daarom null. Demissionair vanaf de verkiezingsdag 12-03-1959 volgens src:pdc-kabinet-beel-ii-1958-1959. Minister-president L.J.M. Beel (KVP) staat niet in people.json.",
    "source": {
      "source": "src:rijksoverheid-kabinet-beel-ii",
      "retrieved": "2026-09-19",
      "confidence": "high"
    }
  },
  {
    "id": "coalition:kabinet-biesheuvel-i",
    "government": "org:regering",
    "name": "Kabinet-Biesheuvel I",
    "parties": [
      "KVP",
      "VVD",
      "ARP",
      "CHU",
      "DS70"
    ],
    "start": "1971-07-06",
    "end": "1972-07-21",
    "demissionairSince": "1972-07-18",
    "primeMinister": null,
    "agreement": null,
    "kind": "meerderheid",
    "notes": "82 van 150 zetels (54,7%) volgens src:pdc-kabinet-biesheuvel-i-en-ii-1971-1973. Partijvolgorde volgens src:pdc-kabinet-biesheuvel-i-en-ii-1971-1973. Ontslagaanvraag kabinet 18-07-1972 (Rijksoverheid; src:pdc-kabinet-biesheuvel-i-en-ii-1971-1973 noemt 22-07-1972). Gesloten op 21-07-1972, de dag waarop DS70 geen deel meer uitmaakte van het kabinet. De Rijksoverheid noemt één kabinet-Biesheuvel; de naam Biesheuvel I volgt src:pdc-kabinet-biesheuvel-i-en-ii-1971-1973. Minister-president B.W. Biesheuvel (ARP) staat niet in people.json.",
    "source": {
      "source": "src:rijksoverheid-kabinet-biesheuvel",
      "retrieved": "2026-09-19",
      "confidence": "high"
    }
  },
  {
    "id": "coalition:kabinet-biesheuvel-ii",
    "government": "org:regering",
    "name": "Kabinet-Biesheuvel II",
    "parties": [
      "KVP",
      "VVD",
      "ARP",
      "CHU"
    ],
    "start": "1972-07-21",
    "end": "1973-05-11",
    "demissionairSince": "1972-11-29",
    "primeMinister": null,
    "agreement": null,
    "kind": "rompkabinet",
    "notes": "Rompkabinet na het vertrek van DS70 (geen deel meer van het kabinet vanaf 21-07-1972 volgens src:pdc-kabinet-biesheuvel-i-en-ii-1971-1973; Rijksoverheid: Udink volgde Drees op 21-07-1972). De ontslagaanvraag van 18-07-1972 werd op 09-08-1972 ingetrokken; daarna missionair minderheidskabinet (74 zetels, 49,3%, src:pdc-kabinet-biesheuvel-i-en-ii-1971-1973) dat vervroegde verkiezingen uitschreef. Demissionair vanaf de verkiezingsdag 29-11-1972 volgens src:pdc-kabinet-biesheuvel-i-en-ii-1971-1973. De Rijksoverheid noemt één kabinet-Biesheuvel; de naam Biesheuvel II volgt src:pdc-kabinet-biesheuvel-i-en-ii-1971-1973. Minister-president B.W. Biesheuvel (ARP) staat niet in people.json.",
    "source": {
      "source": "src:rijksoverheid-kabinet-biesheuvel",
      "retrieved": "2026-09-19",
      "confidence": "high"
    }
  },
  {
    "id": "coalition:kabinet-cals",
    "government": "org:regering",
    "name": "Kabinet-Cals",
    "parties": [
      "KVP",
      "PvdA",
      "ARP"
    ],
    "start": "1965-04-14",
    "end": "1966-11-22",
    "demissionairSince": "1966-10-14",
    "primeMinister": null,
    "agreement": null,
    "kind": "meerderheid",
    "notes": "106 van 150 zetels (70,7%) volgens src:pdc-kabinet-cals-1965-1966. Gevallen in de Nacht van Schmelzer, ontslagaanvraag 14-10-1966 (Rijksoverheid; src:pdc-kabinet-cals-1965-1966 noemt 15-10-1966). Minister-president J.M.L.Th. Cals (KVP) staat niet in people.json.",
    "source": {
      "source": "src:rijksoverheid-kabinet-cals",
      "retrieved": "2026-09-19",
      "confidence": "high"
    }
  },
  {
    "id": "coalition:kabinet-de-jong",
    "government": "org:regering",
    "name": "Kabinet-De Jong",
    "parties": [
      "KVP",
      "ARP",
      "CHU",
      "VVD"
    ],
    "start": "1967-04-05",
    "end": "1971-07-06",
    "demissionairSince": "1971-04-28",
    "primeMinister": null,
    "agreement": null,
    "kind": "meerderheid",
    "notes": "86 van 150 zetels (57,3%) volgens src:pdc-kabinet-de-jong-1967-1971. Partijvolgorde volgens src:pdc-kabinet-de-jong-1967-1971. Ontslagaanvraag 28-04-1971 volgens src:pdc-kabinet-de-jong-1967-1971. Minister-president P.J.S. de Jong (KVP) staat niet in people.json.",
    "source": {
      "source": "src:rijksoverheid-kabinet-de-jong",
      "retrieved": "2026-09-19",